{
  "oati_version": "1.0",
  "id": "oati:tx:conformance:crypto-1",
  "agent_id": "oati:agent:conformance:sender",
  "organisation_id": "oati:org:conformance",
  "mandate_id": "oati:mandate:conformance:crypto-1",
  "action": "api.invoke",
  "resource": "oati:service:conformance:echo",
  "issued_at": "2026-07-27T12:00:00Z",
  "nonce": "document-nonce-0000000001"
}
